Status,Finding Title,Finding ID,Severity,Scanner,Resource,Resolution / Justification
RESOLVED,Lambda missing ReservedConcurrentExecutions,LAMBDA_CONCURRENCY_CHECK (findings 6 & 7),high,cfn-guard,BootstrapUploadFunction & EIPAssociationFunction,"Set ReservedConcurrentExecutions: 1 on both functions. Both are CloudFormation custom resources invoked synchronously once at create and once at delete — concurrency of 1 matches actual execution pattern."
RESOLVED,S3 bucket missing versioning,CKV_AWS_21 (finding 3),high,Checkov,BootstrapBucket,"Added VersioningConfiguration: Status: Enabled. Low-risk bucket with a single immutable object but zero-cost to enable."
NOT APPLICABLE,Secrets Manager secret not encrypted with KMS CMK,CKV_AWS_149 (finding 1),high,Checkov,DCVPasswordSecret,"Secret is encrypted at rest using the default aws/secretsmanager service key. A customer-managed CMK adds key management overhead (rotation policy key policy cross-account considerations) with no security benefit for a single DCV desktop password in a trial deployment. The secret is scoped to a single stack and accessed only by the head node IAM role. CMK encryption is appropriate for production deployments with compliance requirements around key custody."
NOT APPLICABLE,S3 bucket missing access logging,CKV_AWS_18 (finding 2),high,Checkov,BootstrapBucket,"Bucket contains a single bootstrap shell script written once at stack creation by a Lambda custom resource. No user-facing read/write access. Access logging requires a separate destination bucket adding resource overhead for a bucket with effectively zero access surface. The bucket already enforces encryption (AES256) full public access block and deny-insecure-transport policy."
NOT APPLICABLE,Inline policies on IAM roles,IAM_NO_INLINE_POLICY_CHECK (findings 4 & 5),high,cfn-guard,BootstrapUploadRole & EIPAssociationRole,"Both roles are single-purpose Lambda execution roles with tightly scoped inline policies. Inline policies are appropriate here because the policies have no reuse case — they exist solely for these Lambda functions and are deleted with the stack. Converting to managed policies would add template resources with no security improvement."
NOT APPLICABLE,Lambda missing dead letter queue,LAMBDA_DLQ_CHECK (findings 8 & 9),high,cfn-guard,BootstrapUploadFunction & EIPAssociationFunction,"Both functions are CloudFormation custom resources invoked synchronously via cfnresponse. CloudFormation waits for the response and handles failures through stack rollback. There is no asynchronous invocation path so a DLQ would never receive messages. Adding a DLQ and associated SQS queue would be dead infrastructure."
NOT APPLICABLE,Lambda not inside VPC,LAMBDA_INSIDE_VPC (findings 10-13),high,cfn-guard,BootstrapUploadFunction & EIPAssociationFunction,"Both functions call only public AWS API endpoints (S3 and EC2). They do not access any VPC-internal resources. Placing them in a VPC would require a NAT Gateway (~$32/month) or VPC endpoints adding cost and deployment complexity with no security benefit. This rule targets functions accessing private resources (RDS ElastiCache etc.) not utility functions calling public AWS APIs."
